{
  "$schema": "https://json-schema.org/draft/2020-12/schema",
  "$id": "blindassist_ustrf_route_target_r2_l1x_l2p_prereg_r1",
  "title": "USTRF route-target R2-L1X-L2P preregistration R1",
  "type": "object",
  "additionalProperties": false,
  "required": [
    "schema",
    "stage",
    "status",
    "frozen_on",
    "baseline_commit",
    "terminal_states",
    "authority",
    "freeze_order",
    "immutable_r1_parent",
    "preoutput_frozen_contracts",
    "execution_recovery",
    "l1_profile",
    "mechanism_gap_audit",
    "implementation_bindings"
  ],
  "properties": {
    "schema": {
      "const": "blindassist_ustrf_route_target_r2_l1x_l2p_prereg_r1"
    },
    "stage": {
      "const": "R2-L1X-L2P"
    },
    "status": {
      "const": "FROZEN_BEFORE_ANY_NEW_C1_C3_OUTPUT"
    },
    "frozen_on": {
      "const": "2026-07-24"
    },
    "baseline_commit": {
      "const": "ed1e9ce7f508bebbebcc9ab9532a4aa0c4bd5a4d"
    },
    "terminal_states": {
      "type": "array",
      "uniqueItems": true,
      "minItems": 3,
      "maxItems": 3,
      "items": {
        "enum": [
          "L2_FRESH_SELECTION_PREREG_READY",
          "FAIL_CLOSED_INPUT_BLOCKED",
          "FAIL_CLOSED_EXECUTION_ABORTED"
        ]
      }
    },
    "authority": {
      "type": "object",
      "additionalProperties": {
        "const": false
      }
    },
    "freeze_order": {
      "type": "object"
    },
    "immutable_r1_parent": {
      "type": "object"
    },
    "preoutput_frozen_contracts": {
      "type": "object"
    },
    "execution_recovery": {
      "type": "object"
    },
    "l1_profile": {
      "type": "object"
    },
    "mechanism_gap_audit": {
      "type": "object"
    },
    "implementation_bindings": {
      "type": "object"
    }
  }
}

