{
  "$schema": "../schemas/ustrf_route_target_r2_l1x_l2p_prereg_r1.schema.json",
  "schema": "blindassist_ustrf_route_target_r2_l1x_l2p_prereg_r1",
  "stage": "R2-L1X-L2P",
  "status": "FROZEN_BEFORE_ANY_NEW_C1_C3_OUTPUT",
  "frozen_on": "2026-07-24",
  "baseline_commit": "ed1e9ce7f508bebbebcc9ab9532a4aa0c4bd5a4d",
  "terminal_states": [
    "L2_FRESH_SELECTION_PREREG_READY",
    "FAIL_CLOSED_INPUT_BLOCKED",
    "FAIL_CLOSED_EXECUTION_ABORTED"
  ],
  "authority": {
    "new_replay_data": false,
    "candidate_selection": false,
    "candidate_ranking": false,
    "candidate_recommendation": false,
    "provisional_selection_output": false,
    "android_shadow": false,
    "l3_execution": false,
    "h2": false,
    "human_outcome": false,
    "independent_walking_safety": false,
    "production": false
  },
  "freeze_order": {
    "l2_and_l3_contracts_validated_before_any_new_candidate_output": true,
    "required_metrics_frozen": true,
    "performance_gates_frozen": true,
    "primary_metric_frozen": true,
    "tie_break_order_frozen": true,
    "candidate_order_frozen": true,
    "single_run_rule_frozen": true,
    "source_family_gates_frozen": true,
    "hard_vetoes_frozen": true,
    "data_role_isolation_frozen": true,
    "selection_semantics_frozen": true,
    "later_l1_relative_results_cannot_amend_l2_or_l3_contracts": true
  },
  "immutable_r1_parent": {
    "historical_terminal_state": "FAIL_CLOSED_EXECUTION_ABORTED",
    "historical_attempts_are_read_only": true,
    "historical_attempts_count_toward_r2": false,
    "historical_candidate_execution_started": false,
    "historical_authoritative_trace_count": 0,
    "historical_profile_count": 0,
    "bindings": {
      "config": {
        "path": "configs/ustrf_route_target_l1_exploratory_profile_r1.json",
        "sha256": "9cd46c71426ce97420b1565808af58388299e4bf7f2ab58a2f22ffb476136922"
      },
      "core": {
        "path": "scripts/research/ustrf_route_target_evidence_closure/exploratory_profiles_r2_l1.py",
        "sha256": "11c971f69ece0c5bea8e093b212072255842646318add065e35e7bfe0a8b608d"
      },
      "terminal_receipt": {
        "path": "artifacts.local/evidence/ustrf-route-target-l1-exploratory-profile-r1/terminal-receipt-r1.json",
        "sha256": "2be31cca0b64f195e648293a2c0ef4a85e1e57dd5d9730099c58bbaf73df7e6d"
      },
      "validation_receipt": {
        "path": "artifacts.local/evidence/ustrf-route-target-l1-exploratory-profile-r1/validation-receipt-r1.json",
        "sha256": "9cd1b5d6bd2b564c1787c25005a7e7fa733af53bea7f53d3d8180fa687ebecff"
      },
      "resource_guard_attempts": {
        "path": "artifacts.local/evidence/ustrf-route-target-l1-exploratory-profile-r1/resource-guard-attempts-r1.json",
        "sha256": "b0f1940c225fb4eed966a853a65bc4b6600a8d81f356312e6bd6bb7e9e1846a5"
      },
      "lilocbench_dynamics_compact": {
        "path": "artifacts.local/evidence/ustrf-route-target-l1-exploratory-profile-r1/detector-ledgers/lilocbench_dynamics_0_front__lilocbench_dynamics_0_front__f090ea48e6e4.json",
        "sha256": "3e328f3073c3af3afd43ccaf33f2b229e9a2183a3ed8b76786196c2d3c2d8009"
      },
      "lilocbench_dynamics_successor": {
        "path": "artifacts.local/evidence/ustrf-route-target-l1-exploratory-profile-r1/detector-ledgers/lilocbench_dynamics_0_front__lilocbench_dynamics_0_front__f090ea48e6e4.successor-receipt.json",
        "sha256": "2cb06bc39ed62966fd3372ac979054102084710e7293a5544df6968c9468883b"
      },
      "lilocbench_lt_changes_compact": {
        "path": "artifacts.local/evidence/ustrf-route-target-l1-exploratory-profile-r1/detector-ledgers/lilocbench_lt_changes_dynamics_0_front__lilocbench_lt_changes_dynamics_0_front__6e6b0dbd60f6.json",
        "sha256": "9f8b74e1036a381f76da7ab2530dcfa5cd87dd0c405773cecd14f06fa17e069a"
      },
      "lilocbench_lt_changes_successor": {
        "path": "artifacts.local/evidence/ustrf-route-target-l1-exploratory-profile-r1/detector-ledgers/lilocbench_lt_changes_dynamics_0_front__lilocbench_lt_changes_dynamics_0_front__6e6b0dbd60f6.successor-receipt.json",
        "sha256": "6f29acf0ca1da60ab07b3cec753394ff5bca31ff86553aba0dbd8cc58daf20ef"
      }
    }
  },
  "preoutput_frozen_contracts": {
    "l2_prereg": {
      "path": "configs/ustrf_route_target_l2_fresh_selection_prereg_r1.json",
      "sha256": "1ebd6fc26ee0f4d1fe511f1749a184cfa1ce7eb9fc2b667e7380089e1cc77b29"
    },
    "l3_lockbox_template": {
      "path": "configs/ustrf_route_target_l3_confirmation_lockbox_template_r1.json",
      "sha256": "d804fd675ddb4df33311c2004261c90c91b3992eba9783c3cd3b47d2c16c8d98"
    },
    "l2_l3_validator": {
      "path": "scripts/research/ustrf_route_target_evidence_closure/validate_l2_l3_prereg_r1.py",
      "sha256": "e7d3eb5d3be5d7d64a92720bec25742cebb723dbec9bb1abe444908d7aaa7f98"
    }
  },
  "execution_recovery": {
    "stage": "R2-L1E-R2",
    "attempt_namespace": "r2-l1e-r2",
    "output_root": "artifacts.local/evidence/ustrf-route-target-r2-l1x-l2p-r1",
    "parent_r1_attempts_count_toward_this_stage": false,
    "initial_attempts": 1,
    "bounded_retries": 2,
    "resume_from": "first_missing_crowdbot_ledger_after_revalidating_all_existing_successor_bindings",
    "per_ledger_chain": [
      "device_canonical_raw",
      "raw_receipt",
      "host_compact_detector_ledger",
      "successor_receipt",
      "bounded_cleanup"
    ],
    "outcome_unseen_transport_amendment_only": true,
    "new_device_class_and_remote_namespace_only": true,
    "model_labels_thresholds_preprocess_nms_tracker_candidates_unchanged": true,
    "full_raw_monolith_forbidden": true,
    "host_pil_reconstruction_forbidden": true,
    "future_truth_scoring_fields_or_candidate_outputs_forbidden_from_input": true,
    "resource_guards": {
      "output_root": "artifacts.local/evidence/ustrf-route-target-r2-l1x-l2p-r1",
      "minimum_free_space_formula": "2 * projected_shard_bytes + 5GiB",
      "reserve_bytes": 5368709120,
      "host_maximum_rss_bytes": 8589934592,
      "minimum_system_available_physical_memory_bytes": 6442450944,
      "maximum_thermal_status": 2,
      "maximum_final_battery_temperature_c": 45.0,
      "maximum_battery_temperature_rise_c": 8.0,
      "maximum_retry_count_after_initial_attempt": 2,
      "cleanup_retry_count": 2,
      "network_allowed": false
    }
  },
  "l1_profile": {
    "candidate_order": [
      "C1_CAUSAL_ROUTE_RELATION_FSM",
      "C2_ROUTE_OCCUPANCY_EPISODE_FSM",
      "C3_DUAL_KEY_CLEARANCE_FSM"
    ],
    "runs_per_candidate": 1,
    "expected_sequence_ledgers_per_candidate": 41,
    "expected_frames_per_candidate": 62229,
    "expected_discontinuity_resets_per_candidate": 15,
    "state_resets_at_sequence_start_and_frozen_discontinuity_only": true,
    "truth_join_after_candidate_output_persisted": true,
    "first_valid_complete_trace_is_authoritative": true,
    "partial_trace_has_profile_authority": false,
    "metric_authority": {
      "L1": [
        "critical_miss",
        "clearance",
        "unknown_or_stale_alert"
      ],
      "CONDITIONAL_L1": [
        "repeat",
        "evidence_age"
      ],
      "L0_DIAGNOSTIC_ONLY": [
        "event_recall",
        "regeneration",
        "false_alerts_per_minute"
      ]
    },
    "winner_rank_best_candidate_promotion_fields_forbidden": true
  },
  "mechanism_gap_audit": {
    "runs_only_after_full_l1_profile_validation": true,
    "per_metric_common_failure_required": true,
    "per_metric_candidate_specific_failure_required": true,
    "source_and_provenance_family_support_required": true,
    "denominator_and_hard_veto_required": true,
    "separate_algorithm_input_identity_route_lifecycle_and_power_gaps": true,
    "not_evaluable_is_never_zero": true,
    "pooled_result_cannot_override_evaluable_source_failure": true,
    "winner_rank_best_candidate_or_total_score_forbidden": true,
    "l2_justification_is_for_preregistration_only": true
  },
  "implementation_bindings": {
    "prereg_schema": {
      "path": "schemas/ustrf_route_target_r2_l1x_l2p_prereg_r1.schema.json",
      "sha256": "b6f7371fea752da6bdeca007bde48edb928ecd7df1ec94497677c6697cb6a99a"
    },
    "terminal_schema": {
      "path": "schemas/ustrf_route_target_r2_l1x_l2p_terminal_receipt_r1.schema.json",
      "sha256": "5be2e79fa0690c8a688839b1e3db5b175c7aa75a6aca485e7fd9d78ec95f914c"
    },
    "l2_schema": {
      "path": "schemas/ustrf_route_target_l2_fresh_selection_prereg_r1.schema.json",
      "sha256": "5fc4d835381a86bc5b57fc8fe8b5100c40daf18f56ad059952c6b472cff3c59b"
    },
    "l3_schema": {
      "path": "schemas/ustrf_route_target_l3_confirmation_lockbox_template_r1.schema.json",
      "sha256": "ba3f5770e7661c05c8a975fa82c5867611a235aeb01624cba3decca198baf286"
    },
    "r2_core": {
      "path": "scripts/research/ustrf_route_target_evidence_closure/r2_l1x_l2p.py",
      "sha256": "37ef4389ba879a5e49eed7c45624b768be000a9e79a1ca85e2cd2bbde51f2012"
    },
    "runner": {
      "path": "scripts/research/ustrf_route_target_evidence_closure/run_r2_l1x_l2p.py",
      "sha256": "180a388e919ad1321bc3ea7eb215f37b45d4285ae0234ece163643489ca6d7c9"
    },
    "finalizer": {
      "path": "scripts/research/ustrf_route_target_evidence_closure/finalize_r2_l1x_l2p.py",
      "sha256": "ee5b3c7fa76a297cea80baf9af5f06d5a3258071dd92c15c4dadaf46dfaf0557"
    },
    "validator": {
      "path": "scripts/research/ustrf_route_target_evidence_closure/validate_r2_l1x_l2p.py",
      "sha256": "f8f0ba19325011630bf3f85402746a73809167b1c4818b33330882002010dfa5"
    },
    "mutation_tests": {
      "path": "scripts/research/ustrf_route_target_evidence_closure/test_r2_l1x_l2p.py",
      "sha256": "3343fa538ff7e68155cabb70ce8c9bd7d5367f12ec6e2a83ec32311b4472d846"
    },
    "l2_l3_mutation_tests": {
      "path": "scripts/research/ustrf_route_target_evidence_closure/test_l2_l3_prereg_r1.py",
      "sha256": "fe9cbf5119b13f8f96f16f1fb813a8e3cf2020ac1f29f7d15e6b0e80c7b96dc7"
    },
    "device_exporter": {